<?xml version="1.0" encoding="UTF-8"?>
<?xml-stylesheet type="text/xsl" href="magazines.xsl"?>
<mag:magazines xmlns:mag="http://ua.nure/magazines/"
               xmlns:xsi="http://www.w3.org/2001/XMLSchema-instance"
               xsi:schemaLocation="http://ua.nure/magazines/ ../xsd/magazines.xsd">

    <mag:magazine id="1">
        <mag:title>Cool Mag 1</mag:title>
        <mag:description>-</mag:description>
        <mag:price>999</mag:price>
        <mag:publishing>
            <mag:perMonthPublishCount>2</mag:perMonthPublishCount>
        </mag:publishing>
        <mag:category>it</mag:category>
    </mag:magazine>

    <mag:magazine id="2">
        <mag:title>Cool Mag 2</mag:title>
        <mag:description>-</mag:description>
        <mag:price>123</mag:price>
        <mag:publishing>
            <mag:perMonthPublishCount>3</mag:perMonthPublishCount>
        </mag:publishing>
        <mag:category>politics</mag:category>
    </mag:magazine>

    <mag:magazine id="3">
        <mag:title>Cool Mag 3</mag:title>
        <mag:description>-</mag:description>
        <mag:price>321</mag:price>
        <mag:publishing>
            <mag:publishType>daily</mag:publishType>
        </mag:publishing>
        <mag:category>sport</mag:category>
    </mag:magazine>

</mag:magazines>
